{
  "allow_open_blocker": true,
  "base": "v0.3.0",
  "build_doc": "docs/plans/2026-09-18-signpost-rows.md",
  "input_version": 1,
  "invocation": {
    "caller": "ship",
    "harness": null,
    "mode": "station"
  },
  "run_dir": "/tmp/build-c-20260922-7f3c",
  "run_id": "build-b-20260922-blk1",
  "slice": "B",
  "workspace": "/home/builder/work/signpost"
}
